{
 "artist": "That Boy Hi Hat",
 "artist_spotify_id": "2f9j460EwjfvjYp3trBcb7",
 "as_of": "2026-09-17",
 "honest_limits": [
  "Positions are snapshots. Curators can add, remove, or reorder tracks at any time; a position shown here was true at verified_at, not necessarily now.",
  "Follower counts are snapshots with their own dates, not live numbers.",
  "Spotify's API exposes no play counts; this wall reports placements, not streams.",
  "Claims not yet confirmed by a full scan (e.g. DJ 6Rings' It's Goin, WATCH THA GAP VOL.5's Ultimate) are deliberately excluded \u2014 claims are not placements."
 ],
 "kill_rule": "If no fresh Spotify scan verifies this data within 30 days, every card flips to STALE. If scans stop entirely, this wall is retired \u2014 a wall of stale placements is a vanity metric dressed as truth.",
 "placements": [
  {
   "curator": "Audiartist",
   "followers_snapshot_date": "2026-09-16",
   "id": "pl_01M2QX7P9K8RVTN3W0EFGHJ6KLM",
   "note": "Holding across consecutive scans. All three CWI submissions (Zooted Zone, Doves & Diamonds, Shaka Zulu) accepted onto this playlist.",
   "of_total": 140,
   "playlist_followers_snapshot": 673,
   "playlist_name": "New Rap Hits",
   "playlist_size_snapshot": 140,
   "playlist_spotify_id": "5zhnSpZqKRRaOvRMWuT0bL",
   "position": 21,
   "proof_url": "https://open.spotify.com/playlist/5zhnSpZqKRRaOvRMWuT0bL",
   "track": "Shaka Zulu",
   "track_spotify_id": "3pQEzg7xFqGIk0CK1Za1Kw",
   "verification": "VERIFIED",
   "verified_at": "2026-09-17T03:30:00-04:00"
  },
  {
   "curator": "Audiartist",
   "followers_snapshot_date": "2026-09-16",
   "id": "pl_01M2QX7P9K8RVTN3W1EFGHJ6KLM",
   "note": "Holding across consecutive scans.",
   "of_total": 140,
   "playlist_followers_snapshot": 673,
   "playlist_name": "New Rap Hits",
   "playlist_size_snapshot": 140,
   "playlist_spotify_id": "5zhnSpZqKRRaOvRMWuT0bL",
   "position": 30,
   "proof_url": "https://open.spotify.com/playlist/5zhnSpZqKRRaOvRMWuT0bL",
   "track": "Zooted Zone",
   "track_spotify_id": "0emH8ktA8x4DkOFLsG5xkW",
   "verification": "VERIFIED",
   "verified_at": "2026-09-17T03:30:00-04:00",
   "artwork": "assets/covers/zooted-zone.jpg"
  },
  {
   "curator": "Audiartist",
   "followers_snapshot_date": "2026-09-16",
   "id": "pl_01M2QX7P9K8RVTN3W2EFGHJ6KLM",
   "note": "Holding across consecutive scans.",
   "of_total": 140,
   "playlist_followers_snapshot": 673,
   "playlist_name": "New Rap Hits",
   "playlist_size_snapshot": 140,
   "playlist_spotify_id": "5zhnSpZqKRRaOvRMWuT0bL",
   "position": 31,
   "proof_url": "https://open.spotify.com/playlist/5zhnSpZqKRRaOvRMWuT0bL",
   "track": "Doves & Diamonds",
   "track_spotify_id": "4NAyd7rvnuG3DrPFqXo4eQ",
   "verification": "VERIFIED",
   "verified_at": "2026-09-17T03:30:00-04:00",
   "artwork": "assets/covers/doves-and-diamonds.jpg"
  },
  {
   "curator": "Flow",
   "followers_snapshot_date": null,
   "id": "pl_01M2QX7P9K8RVTN3W3EFGHJ6KLM",
   "note": "Re-verified live this morning after two absent scans on 2026-09-15. Late delivery, now a confirmed placement.",
   "of_total": 21,
   "playlist_followers_snapshot": null,
   "playlist_name": "No Label Needed",
   "playlist_size_snapshot": 21,
   "playlist_spotify_id": "79Qj8SYOl5zW4m4dMprrX9",
   "position": 21,
   "proof_url": "https://open.spotify.com/playlist/79Qj8SYOl5zW4m4dMprrX9",
   "track": "Zooted Zone",
   "track_spotify_id": "0emH8ktA8x4DkOFLsG5xkW",
   "verification": "VERIFIED",
   "verified_at": "2026-09-17T03:30:00-04:00",
   "artwork": "assets/covers/zooted-zone.jpg"
  },
  {
   "curator": "Eric Alper",
   "followers_snapshot_date": null,
   "id": "pl_01M2QX7P9K8RVTN3W4EFGHJ6KLM",
   "note": "Added 2026-09-17 in direct reply to the 2026-09-14 pitch. Eric Alper has since reached out to discuss PR in Canada and worldwide.",
   "of_total": 216,
   "playlist_followers_snapshot": null,
   "playlist_name": "360\u00b0 : The Best Indie Music",
   "playlist_size_snapshot": 216,
   "playlist_spotify_id": "0hsLLFaADDjU54tFqaImFh",
   "position": 216,
   "proof_url": "https://open.spotify.com/playlist/0hsLLFaADDjU54tFqaImFh",
   "track": "Zooted Zone",
   "track_spotify_id": "0emH8ktA8x4DkOFLsG5xkW",
   "verification": "VERIFIED",
   "verified_at": "2026-09-17T03:20:00-04:00",
   "artwork": "assets/covers/zooted-zone.jpg"
  }
 ],
 "schema": "cwi.placement-record/1.0",
 "verification_method": "CWI data engine \u2014 Spotify Web API full-playlist scans. Positions are snapshots at verified_at and can drift as curators edit playlists."
}